image_name| comment_number| comment
1022454428.jpg| 0| Хос, нялх хүүхэд , эрэгтэй нь барьж , ойролцоох жолоочтой цөөрмийн хажууд сууж .
1022454428.jpg| 1| Усны хажуу талын нялхасыг эрэгтэй эмэгтэй хүн асарч .
1022454428.jpg| 2| Дөнгөж төрсөн бяцхан үртэйгээ нуур руу харсан модны доор сууж буй хос .
1022454428.jpg| 3| Хүүхэдтэй хос жолооч нь хажууд нь гадаа суудаг .
1022454428.jpg| 4| Хос өвсөнд хүүхэд, алхагчтай сууна .
102268204.jpg| 0| Гурван хүн шөнө дугуйгаар дүүрсэн хоргодох байрны ойролцоо хар машины дэргэд зогсож байна .
102268204.jpg| 1| Зарим эрчүүд машины зогсоолын хажуугийн барилгын өмнө зогсож .
102268204.jpg| 2| Өнөө орой хазайсан дээвэр дор олон дугуй зогсож байна .
102268204.jpg| 3| цагдаа нар шөнийн цагаар хар тэрэгний жолоочийг байцааж .
102268204.jpg| 4| Хар буудлагын тэрэгний дэргэд цамхаг дор эрчүүд .
1022975728.jpg| 0| Усанд шошгыг нь frolicks бүхий хар лаборатори .
1022975728.jpg| 1| Энэ бол усанд цацаж буй хар нохой .
1022975728.jpg| 2| Хар нохой усаар гүйдэг .
1022975728.jpg| 3| Гүйдэг хар нохой .
1022975728.jpg| 4| Нохой усанд шүршдэг
102351840.jpg| 0| Цөөрмийн хөлдүү мөсөн дундуур хүн ухаж байна .
102351840.jpg| 1| Мөсөнд нүх ухсан хүн .
102351840.jpg| 2| Хөлдүү нууран дээр зогсож байгаа хүн .
102351840.jpg| 3| Мөсөнд нүх ухаж буй хүн .
102351840.jpg| 4| Хоёр хүн мөсний загас .
1024138940.jpg| 0| Бор, цагаан нохойны хоёр өөр үр . далайн эрэг дээр .
1024138940.jpg| 1| Хоёр нохой зөөлөн элс далайн эрэг дээр ээлж . хийж байна .
1024138940.jpg| 2| Элсэрхэг эрэг дагуу хоёр том цорго нохой тоглох .
1024138940.jpg| 3| Далайн эрэг дээр элсэнд тоглож буй хоёр нохой .
1024138940.jpg| 4| Хоёр нохой далайн эрэг дээр хамт тоглож .
102455176.jpg| 0| цэнхэр хантаазтай мөсөн авирагч , хар өмд нь хөлдүү мөсөн ханыг хэмждэг .
102455176.jpg| 1| Цэнхэр, улаан мөстэй хүн хоёр сондгод авирч байна .
102455176.jpg| 2| Эрэгтэй хүн мөсний . мөсний хэмжээ , крампоныг ашигладаг .
102455176.jpg| 3| Мөстлөгийн гулгалтын . хөлдүү усан оргилуурыг хэмжсэн мөсөн авирагч .
102455176.jpg| 4| Мөсөн хананд авирагч авирагч
1024613706.jpg| 0| Хоёр залуу, нэг бүсгүй хоёр усан ойролцоох талбайгаар алхана .
1024613706.jpg| 1| Далайн зүг үзэсгэлэнт довоор алхаж буй гурван хүн .
1024613706.jpg| 2| Хоёр эрэгтэй, нэг эмэгтэй хүн талбай дээр явж байна .
1024613706.jpg| 3| Хоёр эрэгтэй, нэг эмэгтэй замаар алхаж байна .
1024613706.jpg| 4| Зайсанд зам дээр 3 хүн явж байна .
102520526.jpg| 0| Хар өнгийн хувцас өмссөн эр гудамж руу цас орж , олон нийтийн аюулгүй байдлыг үл тоомсорлон .
102520526.jpg| 1| Хар хантаазтай саарал цасны малгайтай хүн . Машинтай гудамжны ойролцоо цас .
102520526.jpg| 2| Хот дотор зам, явган хүний замаас цас шүүрсэн хүн .
102520526.jpg| 3| Хүн хотын явган хүний замын цас, мөсийг цэвэрлэж байна .
102520526.jpg| 4| Нэгэн эр гудамжны налууг .
102575576.jpg| 0| Хуримын хувцастайгаа хос хуримын бялуу, цэцэгтэй ширээний ард зогсож байна .
102575576.jpg| 1| Сүйт бүсгүй, сүйт залуу хоёр хуримын бялуугаа хүлээн авалтынхаа өмнө зогсож байна .
102575576.jpg| 2| Хуримын бялуугаа үзэж байхдаа сүйт бүсгүй, сүйт залуу хоёр инээмсэглэдэг .
102575576.jpg| 3| Хос хуримын бялууныхаа ард зогсож байна .
102575576.jpg| 4| Хуримын бялуу хайчлах эрэгтэй, эмэгтэй .
102617084.jpg| 0| Дуулга, нүдний шил зүүсэн таван цасан моторт дугуйчин бүгд цасны моторт дугуйныхаа өмнө ойд цастай цэвэрлэгээнд эгнэн зогсож; тэд бүгд хар цасан өмд өмсөж, зүүнээс баруун тийш хар хүрэм , цагаан хүрэм , улаан хүрэм , хөх хүрэм , хар хүрэм .
102617084.jpg| 1| Өвлийн хантааз, дуулга өмссөн 5 хүн цасан дээр зогсож байна . Ар талд нь цасан .
102617084.jpg| 2| Өвлийн хувцас , дуулга , цанын нүдний шил зүүсэн 5 хүн цасанд гадаа зогсож .
102617084.jpg| 3| Цасны гулгагч хэсэг хүмүүс цасанд цуглана .
102617084.jpg| 4| Бүлгээр цасны хөдөлгөөн хийхээр цугларав .
1026685415.jpg| 0| Хар нохой өвсөөр алхахдаа амандаа ногоон өнгийн .
1026685415.jpg| 1| Нойтон хар нохой өвсөөр ногоон өнгийн . авч явж байна .
1026685415.jpg| 2| Өвсөөр ямар нэг юм тээсэн хар нохой .
1026685415.jpg| 3| Амандаа хөх юмтай өвсөнд нохой .
1026685415.jpg| 4| Хар нохой амандаа хөх өнгөтэй .
1026792563.jpg| 0| Хэсэг эмэгтэй, хүүхдүүд зогсож эсвэл эгнээний хүнсний ногооны өмнө сууж .
1026792563.jpg| 1| Хэсэг эмэгтэйчүүд ногоо тариалах . борлуулах гэж .
1026792563.jpg| 2| Хүмүүс гудамжны зах дээр хөнжлөөр хүнсний ногоо .
1026792563.jpg| 3| Тариаланчид зах дээр тариагаа зарж .
1026792563.jpg| 4| Эдгээр нь маш том сонгино .
1027149103.jpg| 0| Нэгэн хамтлаг үзэгчдийн өмнө тоглож байгаа бөгөөд дуучин улбар шар цамц өмсөж, гар дээрээ шивээстэй .
1027149103.jpg| 1| Хөл хөдөлгөөн ихтэй концертонд цагаан хувцастай эрэгтэй шар цамц өмссөн гол дуучин руу ойртож байна .
1027149103.jpg| 2| Шар футболк өмссөн хүн микрофон руу хашгирч байна. Үзэгчдийг сонсож байхад .
1027149103.jpg| 3| Улбар шар өнгийн цамц өмссөн эрэгтэй азтай 13 гэсэн тэмдэг доор цугласан олонд зориулан дуулан .
1027149103.jpg| 4| Концертын тайзан дээр хашгирч буй панк рокер .
1027211271.jpg| 0| Богино шаргал үстэй, жинсэн өмд өмссөн, урт ханцуйтай цамцтай, ар талд нь модтой скэйтборд дээр скэйт самбар дээр үсэрч буй залуу бүсгүй .
1027211271.jpg| 1| Нэгэн залуу скэйт цэцэрлэгт хүрээлэнд скэйтбордоор явж байхдаа ард нь хүмүүс түүнийг харж байлаа .
1027211271.jpg| 2| Энэ хүн скэйтбордын тэмцээнд . арга мэхийг гүйцэтгэж байна . Ар талд нь хүмүүс харж .
1027211271.jpg| 3| Олон хүн харж байхад нэгэн хөвгүүн скэйтборд дээрээ үсэрчээ
1027211271.jpg| 4| Скэйт цэцэрлэгт хүрээлэнд скэйтбордоор гулгаж байгаа хүн .
1028205764.jpg| 0| Цэнхэр аврах хантаазтай эрэгтэй, бяцхан хүү хоёр шар каноэ завиар сэлүүрдэж байна .
1028205764.jpg| 1| Эрэгтэй хүүхэд хоёр усан дээр шар завиар .
1028205764.jpg| 2| Зөөлөн ус дундуур эрэгтэй хүүхэд хоёр завиар .
1028205764.jpg| 3| Эрэгтэй, залуу хүү хоёр шар завиар явж .
1028205764.jpg| 4| Улбар шар завиар хүн, хүүхэд
102851549.jpg| 0| Бяцхан хүү камер руу харж байхад араас нь эмэгтэй хүн маш их инээж байгаа бололтой, баруун талд байгаа эмэгтэй нүүрэндээ том инээмсэглэл тодруулав .
102851549.jpg| 1| Довжоон дээр 3 хүн . Үүний нэг нь сандал дээрээ эгцлэн сууж байгаа бяцхан хүү .
102851549.jpg| 2| Хар даашинзтай эмэгтэй инээмсэглэж байхад нөгөө талд нь эмэгтэй хүүхэд сандал дээр сууж байлаа .
102851549.jpg| 3| Хоёр хүн сандал дээр сууж байна . Тэдний дэргэд нэг эмэгтэй зогсож .
102851549.jpg| 4| Хоёр эмэгтэй , довжоон дээр сууж байгаа хүү , эмэгтэйчүүд нь хатуу чанга инээж .
102860573.jpg| 0| 3 эрэгтэй ажиллах хүнтэй гудамжинд барилгын талбай .
102860573.jpg| 1| Хатуу малгай өмссөн хоёр хүн барилгын бүсэд .
102860573.jpg| 2| Улбар шар хантаазтай 2 хүн зам барилгын ажилд .
102860573.jpg| 3| Барилгын ажилчид . гэрэлтэй пост суурилуулж .
102860573.jpg| 4| Жүржийн хантаазтай ажилчид гудамжинд ажилладаг .
10287332.jpg| 0| Байшингийн дээвэр дээр сууж байсан хоёр хүн , харин өөр нэг нь шатаар зогсож .
10287332.jpg| 1| Дээвэр дээр хоёр хүн зогсож байхад өөр нэг хүн тэднийг харж шатаар зогсож байна
10287332.jpg| 2| Гурван эр , нэг нь шатаар . дээвэр дээр ажиллах .
10287332.jpg| 3| Хүмүүс байшингийн дээврийг засаж байна .
10287332.jpg| 4| 3 хүн дээвэр дээр ажиллаж байна .
1028982826.jpg| 0| Хоёр эрэгтэй , нэг нь ачаа тээштэй шар цамцтай залуу, нөгөө нь, том байшингийн өмнө сандал дээр сууж байна. Нүдний шил, нарны шилний самбартай .
1028982826.jpg| 1| Шар цамц өмссөн эрэгтэй , өндөр саарал чемодантай , цагаан цамц, саарал өмдтэй өөр хүний хажууд сууж , ард нь нарны шил, жороор олгодог нүдний шилний өндөр зар сурталчилгааны самбар .
1028982826.jpg| 2| Сандал дээр сууж байсан 2 хүн ярьж байна . Ар талд нь нүдний шилний зар сурталчилгааны самбар .
1028982826.jpg| 3| Эрэгтэй, эмэгтэй хүний зурагтай тэмдгийн өмнө сандал дээр сууж буй хоёр хүн .
1028982826.jpg| 4| 2 хүн зарын самбарын өмнө нисэх буудлын гадаа сандал дээр сууж байна .
1029450589.jpg| 0| Улаан ханцуйтай саарал цамц өмссөн насанд хүрсэн хүн буйдан дээр унтаж .
1029450589.jpg| 1| Хар өмд өмссөн эмэгтэй буйдан дээр зүүг .
1029450589.jpg| 2| Ногоон өрөөнд буйдан дээр унтаж буй эр .
1029450589.jpg| 3| Бүсгүй өрөөндөө унтаж байна .
1029450589.jpg| 4| Урт үстэй хүн буйдан дээр унтаж байна
1029737941.jpg| 0| Чихэвчтэй бор цамцтай хүү олны дунд эмэгтэй хүний мөрөн дээр сууж .
1029737941.jpg| 1| Чихэвч зүүсэн хүүхэд олны дунд байхдаа ээжийнхээ мөрөн дээр сууж .
1029737941.jpg| 2| Эмэгтэй хүний мөрөн дээр сууж чихэвчтэй хүү .
1029737941.jpg| 3| Ээжийнхээ мөрөн дээр чихэвчтэй хүүхэд .
1029737941.jpg| 4| Чихэвч зүүсэн хүүхэн эмэгтэй хүний мөрөн дээр сууж .
1029802110.jpg| 0| Азийн нэгэн хотод болсон ижил хүйстнүүдийн бахархлын жагсаалын үеэр зарим хүмүүс дэмжлэг үзүүлэхийн тулд солонгын туг барьж .
1029802110.jpg| 1| Хэсэг залуус гудамжны далбааг даллан , өнгө үзэмжийг харуулсан .
1029802110.jpg| 2| Хотын гудамжаар солонгон тугтай дорнын ард түмэн .
1029802110.jpg| 3| Хэсэг хүмүүс солонгон туг даллан гудамжаар алхана .
1029802110.jpg| 4| Хүмүүс туг даллах гадаа .
102998070.jpg| 0| Цэнхэр цамцтай залуу загас цэвэрлэж байхад өөр гурван хүн харж байхад нэг нь эрэгтэй тамхи . эсвэл сардаа таарч .
102998070.jpg| 1| Гурван настай эрэгтэй загас хийж байгаа гудамжны худалдаачны сав руу ширтэн .
102998070.jpg| 2| Гурван хөгшин өөр нэг хүн загас бэлтгэхийг харж байна .
102998070.jpg| 3| Загас худалдагчдын оймсыг хоёр хөгшин харж байна .
102998070.jpg| 4| Гурван эр загас бэлтгэж байгааг харж .
1030041880.jpg| 0| Ногоон даашинз өмссөн эмэгтэй цагаан оройтой, улаан үстэй хүн цэнхэр дээвэртэй өрөөнд дуулж байхад хамтлагын тоног төхөөрөмж бэлтгэгдэж байх үед .
1030041880.jpg| 1| Цагаан орой, ногоон, цагаан юбкатай улаан үстэй эмэгтэй микрофонд дуулж байна .
1030041880.jpg| 2| Ногоон урсах юбкатай цагаан танкны оройд эмэгтэй хүн . тайзан дээр дуу дуулж .
1030041880.jpg| 3| Ногоон юбка, цагаан цистерн орой дээр нь микрофонд дуулж буй эмэгтэй .
1030041880.jpg| 4| Ногоон юбкатай охин караоке дуулж байна .
103031977.jpg| 0| Коллежийн насны дөрвөн хүн буюу хоёр эрэгтэй, хоёр эмэгтэй хүн тоосгон барилгын гадна бетон шатан дээр сууж байна
103031977.jpg| 1| Барилгын гадна шатан дээр сууж буй хоёр залуу, хоёр охин .
103031977.jpg| 2| 4 хүн барилгын үүдний . шатан дээр сууж .
103031977.jpg| 3| 2 эрэгтэй 2 эмэгтэй гадаа шатан дээр сууж .
103031977.jpg| 4| Сургууль дээр шатаар сууж буй олон оюутан .
1030985833.jpg| 0| Шоколадны лаборатори нь хар лабордоор нь зам дээр нь барьж авах үед энэ нь хэтэрхий оройтсон үсэрдэг .
1030985833.jpg| 1| Бор, хар өнгийн лаборатори гадаа байгаа бөгөөд хар лаборатори нь амандаа нэг . гар хийцийн .
1030985833.jpg| 2| Хар нохой, бор нохой хоёр хашаан дээр улаан тоглоомоор тоглох .
1030985833.jpg| 3| Хар нохой, бор нохой хоёр улаан өнгийн юм барих гэж үсэрч байна .
1030985833.jpg| 4| Хар нохой улаан, хар зүйл дээр . бор нохойны уушигны .
103106960.jpg| 0| Залуу эрэгтэй хоккейн гоолын өмнө баруун гартаа хоккейн саваагаар өвдөглөн .
103106960.jpg| 1| Гудамжны хоккей тоглож байгаа улаан хантаазтай хүүхэд . гоолыг харгалзаж .
103106960.jpg| 2| Хоккейн хаалгач хүү улаан хантаазтай crouches нь гоолоор , саваагаар .
103106960.jpg| 3| Хаалгач торны өмнө өвдөг сөхрөх саваатай хүү
103106960.jpg| 4| Бага насны хүүхэд хоккейн рингэн дээр хаалгач тоглож .
103195344.jpg| 0| Үүргэвчтэй хүн . уран баримал унших урд талын барилгын хашаанд сууж .
103195344.jpg| 1| Хар өнгийн эрэгтэй хүн шилэн барилгын өмнө орчин үеийн урлагийн барилгын дэргэд сууж .
103195344.jpg| 2| Эр хүн сууж сонин унших . оффисын байрны гадаа баримал .
103195344.jpg| 3| Барилгын урд төмөр барималын урд сууж байгаа хүн .
103195344.jpg| 4| эр хүн том хөшөөний дэргэд суудаг .
1031973097.jpg| 0| Улаан шорттой, малгайтай цэнхэр цамцтай хүүхэд тоосгон үүдний хэсэгт хашааны араас харж байна .
1031973097.jpg| 1| Цэнхэр цамц, улаан малгай өмссөн бага насны хүүхэд өмнө нь хар бараан дээр .
1031973097.jpg| 2| Бяцхан хүү хэлж байгаа юм шиг харагдаж байна . Шоронгоос гаръя .
1031973097.jpg| 3| Бага насны хүүхэд улаан малгайт . зарим төмөр бариулаас зуурч .
1031973097.jpg| 4| Хашааны гадна тоглохыг хүссэн бяцхан хүү .
103205630.jpg| 0| Хоёр хүн , мөсөн дээр зогсож , цэнхэр давирхайгаар хучигдсан зүйл рүү харж .
103205630.jpg| 1| Хоёр хүн цасаар хучигдсан нууран дээр мөсөн загасчлах майханд орох гэж байна .
103205630.jpg| 2| Цастай гадаргуу дээр цэнхэр майхны барилгын гадна зогсож буй хоёр хүн .
103205630.jpg| 3| нуурын мөсөн дээр хөх мөстөх загас агнуурын урцыг хоёр хүн тавьжээ
103205630.jpg| 4| Мөсөн дээр майхан босгож байна .
1032122270.jpg| 0| Гурван нохой өвсөнд зогсож, хажууд нь хүн сууж байна
1032122270.jpg| 1| Ойрд хүн өвдөглөж байхад 3 нохой өвсний талбай дээр зогсож байна .
1032122270.jpg| 2| Гурван нохой хөх тэнгэртэй өвсөн толгой дээр тоглож байна .
1032122270.jpg| 3| Нэгэн эмэгтэй хээрийн 3 нохойны ойролцоо .
1032122270.jpg| 4| Гурван ноход өвстэй толгой дээр
1032460886.jpg| 0| Камерын урд алхсан хүн хол тэнгэрийн орон .
1032460886.jpg| 1| Улаан цамцтай хүний ард том тэнгэр баганадсан .
1032460886.jpg| 2| Маш өндөр барилгын урд хүн зогсож байна .
1032460886.jpg| 3| хүн тэнгэрийн өмнө зогсож байна
1032460886.jpg| 4| Тэнгэрийн өмнө зогсож байгаа хүн .
103306033.jpg| 0| Тохирох турбантай бор өнгийн даашинз өмссөн эмэгтэй бага насны хүүхдийг жолооч цэцэрлэгт хүрээлэнгээр нь түрж байна .
103306033.jpg| 1| Африкийн бор өнгийн хувцас өмссөн эмэгтэй бага насны хүүхдийг хөлд нь түлхэж .
103306033.jpg| 2| Орон нутгийн цэцэрлэгт хүрээлэнд нэгэн эмэгтэй хүүхдээ алхан явж байна .
103306033.jpg| 3| Хатагтай хүүхдийг жолоочид түлхэж байна .
103306033.jpg| 4| Эмэгтэй хүүхдээ хөсгүүлэхдээ түлхдэг .
103328091.jpg| 0| Улаан цамц өмссөн Ази эрэгтэй хүн жимс зарж байгаа хүнсний лангууны хажууд сууж .
103328091.jpg| 1| улаан цамцтай хүн . борлуулах жимсний хажууд сууж .
103328091.jpg| 2| Улаан цамцтай хүн жимсээр сууж . борлуулах .
103328091.jpg| 3| Улаан цамцтай эрэгтэй жимсний лангууны хажууд сууж .
103328091.jpg| 4| . бүтээгдэхүүн зарж байгаа дорнын хүн .
1033767085.jpg| 0| толгой дээрээ Банд-Aid-тэй бага насны хүүхэд жижиг цагаан ширээн дээр хоол идэж сууна. Бяцхан охин шар плита идээд .
1033767085.jpg| 1| Залуу шаргал үстэй хүү, хар үстэй охин хүүхдийн ширээн дээр идэж байна .
1033767085.jpg| 2| Хоёр хүүхэд ширээнд сууж хоол идэж байна .
1033767085.jpg| 3| Хоёр хүүхэд жижиг ширээн дээр хоол идэж .
1033767085.jpg| 4| Хоол идэж буй хоёр хүүхэд .
1034276567.jpg| 0| Хоёр гараараа амандаа ямар нэг юм тавьж байгаа бяцхан хүү .
1034276567.jpg| 1| Хүү гадаа сууж байхдаа амттанд хатуу хаздаг .
1034276567.jpg| 2| Хүү гадуур хоолоо идэж ширээн дээр .
1034276567.jpg| 3| Хүү нь tin таваг дээгүүр пицца идэж байна .
1034276567.jpg| 4| Жигнэсэн сайнд хазуулсан хүүхэд .
1034985636.jpg| 0| Зэрлэг үстэй хүн рок гитар төв тайзан дээр тоглож шоу .
1034985636.jpg| 1| Хар хувцас өмссөн хүн концертонд цахилгаан гитар тоглож .
1034985636.jpg| 2| Концертын үеэр тайзан дээр цахилгаан гитар тоглож байгаа хүн .
1034985636.jpg| 3| Тайзан дээр цахилгаан гитар тоглож байгаа хүн .
1034985636.jpg| 4| Концертонд гитар тоглож байгаа хүн .
1035019794.jpg| 0| Ногоон хувцас, дуулга өмссөн хүн бейсболын цохиурыг хашааны өмнө теннисний бөмбөгт шээж байна .
1035019794.jpg| 1| Софтбол тоглож байгаа охин бөмбөгийг бараг шууд доош нь цохив
1035019794.jpg| 2| Нэгэн бяцхан охин бейсбол тоглож байгаа бөгөөд .
1035019794.jpg| 3| Нэгэн охин софтбол цохисон ч бөмбөгөө алдсан .
1035019794.jpg| 4| Батарей бөмбөгийг алгасав .
10350842.jpg| 0| Ногоон цамц, улаан аврах хантаазтай эрэгтэй хүн нуурын эргэн тойронд урсдаг каноэ .
10350842.jpg| 1| Аврах хантааз өмссөн хүн нуурын жижиг завинд усан онгоц харж .
10350842.jpg| 2| Улаан өнгийн амьдралын хантааз өмссөн хүн усан дээр каноэ . сууж .
10350842.jpg| 3| Улаан өнгийн аврах хантааз өмссөн толботой эр жижиг завинд сууж .
10350842.jpg| 4| Улаан амьдралын хантаазтай хүн каноэээр явж байна .
1035392784.jpg| 0| Урт үстэй хар үстэй хүн дээр нь стикертэй гитар тоглож .
1035392784.jpg| 1| Урт үст хөгжимчин , гитараа тоглолтоор .
1035392784.jpg| 2| Рок уран бүтээлч тайзан дээр цахилгаан гитартай тоглолт .
1035392784.jpg| 3| Хар цамцтай хүн хар өнгийн гитар тоглодог .
