image_name| comment_number| comment
8171835256.jpg| 0| Four men with a display table set up on top of boulders and rocks displaying stone plates and other sculptures .
122190424.jpg| 1| A construction crew working at several spots on the road .
2410399168.jpg| 0| One dog is jumping in the air and the other is standing next to it .
7081260077.jpg| 3| Rugby player in blue dives to tackle the ball carrier in white .
2214132302.jpg| 1| A woman in an orange jacket and orange glasses is jogging .
509241560.jpg| 3| A group of kids play on a colorful structure .
4307968.jpg| 0| A girl with brown hair and is wearing a pink and blue striped shirt is standing outside with a bunch of other people .
3442978981.jpg| 2| Two fencers are in a bout in a white gym .
6727599793.jpg| 0| A surfer rides on his stomach on a surfboard in green water .
3515378674.jpg| 0| A male senior citizen is drinking liquor straight from the bottle .
1220401002.jpg| 3| Two girls laughing outside in a yard .
2341080150.jpg| 4| A group of people admiring antique cars .
4751647247.jpg| 2| A long-haired woman listens to music as she walks on a sunny day .
530661899.jpg| 1| Two people backlit with light sky .
492104206.jpg| 4| A homeless man next to a pepsi machine .
4590720793.jpg| 1| Two girls in matching costumes are holding drumsticks .
2537802214.jpg| 2| These people are trying to repair something that needed to be fixed .
4841631694.jpg| 1| A woman , wearing a dark top and jeans , gets down on her knees in the sand to get a better shot with her camera .
2363100645.jpg| 4| A young girl plays guitar by pink walls .
6939434967.jpg| 4| Three girls playing jump rope .
2785108434.jpg| 2| A little kid jumps up into the air above the ocean .
4725033521.jpg| 2| A woman is just shopping her things in a shop .
7715537014.jpg| 0| Six black men are either competing in a track race or practicing for a competition at the London 2012 Olympics .
2056377805.jpg| 4| A group of people river rafting .
4622340284.jpg| 4| A woman is riding a scooter in a middle-eastern country .
2513594933.jpg| 1| A lady in a sexy red dress walks in front of a crowd of men .
3335127933.jpg| 3| Men and women sit in a meeting and listen to a presentation .
3638318149.jpg| 0| A young boy playing on his skateboard on a patio of an interesting building , while two people are sitting in chairs in the background .
4733155804.jpg| 1| A bicyclist is calling someone or checking his text messages .
13651137.jpg| 2| a man in a gray shirt and a hat holding a jackhammer
3036596725.jpg| 1| A white greyhound dog wearing a muzzle runs around a track .
4625651551.jpg| 2| Two brunette females wearing sunglasses in the outdoors .
5171265627.jpg| 4| A man in a suit rides a brown horse .
917574521.jpg| 2| Two children wearing bright pink clothes are playing with a toy lawn mower .
2390400553.jpg| 2| A man on a scaffold hanging by a rope reaches out to a ledge or window .
3441959314.jpg| 3| Two men trying to build a fire .
3725353555.jpg| 1| A tan and black dog jumps through a water sprinkler in the yard .
3432187474.jpg| 1| A man and woman sit on a dock looking out over the water on an overcast day .
4937639267.jpg| 4| A man in a motor cart rides by to witness the park area .
6989990004.jpg| 3| A woman is sitting on a sofa with her feet propped up on a table , while using a laptop .
476769369.jpg| 4| Man in black shirt waiting with luggage .
4531897566.jpg| 3| A man is skiing on the tip of a mountain .
4328442305.jpg| 2| A young person , surrounded by pens and paper , looks like they 're upside down against the wall .
282131366.jpg| 4| A woman leaning to her right as the sun sets .
7656601.jpg| 2| The gentlemen are on the boat deck relaxing .
4147974557.jpg| 4| An older man is sleeping .
4876249897.jpg| 3| A woman in a blue shirt selling flowers .
47576066.jpg| 2| A lady sits in a chair , in front of a graffiti covered wall with a cart full of bags .
527288854.jpg| 4| Man straining to climb cliff face .
2549968784.jpg| 4| A child wearing swim goggles .
405693848.jpg| 4| Man in green shirt riding a stationary bike .
72008635.jpg| 3| Friends , out enjoying a drink together .
3772448117.jpg| 4| A young man lifting a girl at the beach .
4983722231.jpg| 1| A view of the back of a woman having a beverage .
4457340060.jpg| 1| A man wearing sunglasses and a suit is walking down the sidewalk looking at cars .
3767841911.jpg| 2| A little girl in an orange dress is running through the sprinkler in the yard .
2844963839.jpg| 3| a group of football players huddled together in the middle of the field .
1309330801.jpg| 3| Two girls are performing tricks on a trampoline .
6104468585.jpg| 1| A long-haired , shirtless man with face paint is playing a bass guitar at a concert .
3138943319.jpg| 1| A man 's hand extending his cup out to be refilled by a woman at a social event .
3321832766.jpg| 1| An orchestra , in formal dress , with a man playing the cello in the center .
4751210999.jpg| 0| A woman in jeans , sneaker , and sneakers walking down a sidewalk while messaging .
506367606.jpg| 2| A person looking to the right standing between plants in buckets and a banana box .
2921670682.jpg| 4| A man on a bicycle in the city .
4547258202.jpg| 0| A man wearing sunglasses is sitting on the steps outside , reading a magazine .
4710499155.jpg| 2| A group of in blue uniforms are marching and carrying guns .
3831874776.jpg| 3| A merchant is rearranging her items for sale .
3420660565.jpg| 2| Five people are sitting on outdoor furniture underneath a bright red flowering tree .
3166969425.jpg| 4| A dog walks in a foggy place .
3356700488.jpg| 0| A man in a blue shirt and a woman in a white shirt in front of a sign written in an Asian language .
2118795339.jpg| 0| A man walking on a side walking passing the space between two buildings .
5794490455.jpg| 3| Two soccer teams on the field playing soccer .
3108542351.jpg| 4| The man is listening to the guitar player .
3155987659.jpg| 2| Dog is jumping up on a very green lawn to catch a Frisbee .
3794595430.jpg| 0| A woman in a blazer speaking into a mic in front of a crowd with a presentation .
2394857899.jpg| 0| A man in an orange construction uniform wears a white hard hat and sprays a water hose .
6742042393.jpg| 2| A man in a green jersey is jumping in the air getting ready to throw a ball .
2595397765.jpg| 3| A family of five sitting down at a table to eat and enjoy a dinner together .
2635905544.jpg| 2| Two dogs are playing with a red and white ball
4771908421.jpg| 0|" A man in a shirt and tie is standing next to a banner that says "" Aloha . """
4459396414.jpg| 3| A white car is parked by a wall with graffiti .
4941164644.jpg| 0| A boy sits on a grass hill in front of an abstract mobile sculpture .
2198494923.jpg| 4| A young girl is sliding down a snowbank .
389136029.jpg| 2| A woman in a white halter top and white short is motioning with her hands .
4653128161.jpg| 0| Dilapidated buildings in the background of a lot of green grass .
3817024841.jpg| 1| Three people sit together on a couch in a house while two others stand off to the sides .
1273001772.jpg| 4| Children and adults play with a sprinkler .
5404931227.jpg| 4| Two people skiing on a mountain .
3826387121.jpg| 4| Two people walking aside a wall .
3600525829.jpg| 2| Mother and child wearing blue shirts playing outside .
2037916421.jpg| 0| A man in glasses and a white shirt is playing the electric guitar .
